### ISSUE TITLE
why grpc send more data when send small msg

### ISSUE THREAD

**Issue by bugaolengdeyuxiaoer** [grpc/grpc-go#3801]
Please see the FAQ in our main README.md before submitting your issue.Please answer these questions before submitting your issue.

What version of gRPC are you using?
1.27.0

What version of Go are you using (go version)?
1.13.5

What operating system (Linux, Windows, …) and version?
Linux and macos

What did you do?
I have a bidirectional stream opened sending small protobuf messages with ratelimiter.

What did you expect to see?
Bandwidth close to value set by ratelimiter

What did you see instead?
the output bandwidth is more more larger than the value it should be.

the msg I send is 10Byte ,100 Byte 1024 Byte and 10240Byte before marshal (the size of msg increased just 1 to tens  byte after marshal) .But When the msg is less ,the more times of send called  ,the bandwidth is more larger. 
when ratelimiter set 800kbps, msg length is 10Byte,but actual bandwidth more than 6.4mbps. msg length is 10240Byte, bandwidth is 840kbps.

After I capture package with wireshark, I`ve seen the packages send much more DataFrame but I don`t know why.

such like :
605	11.030784	127.0.0.1	127.0.0.1	TCP	8962	8081 → 64886 [PSH, ACK] Seq=22793 Ack=872 Win=407424 Len=8906 TSval=758039234 TSecr=758039234
607	11.031636	127.0.0.1	127.0.0.1	TCP	640	8081 → 64886 [PSH, ACK] Seq=31699 Ack=872 Win=407424 Len=584 TSval=758039235 TSecr=758039234
615	11.033287	127.0.0.1	127.0.0.1	TCP	2409	8081 → 64886 [PSH, ACK] Seq=32446 Ack=902 Win=407360 Len=2353 TSval=758039236 TSecr=758039235
623	11.033811	127.0.0.1	127.0.0.1	TCP	365	8081 → 64886 [PSH, ACK] Seq=35091 Ack=932 Win=407360 Len=309 TSval=758039236 TSecr=758039236

this test msgSize is 10Bytes and 8081 is server port 64886 is client port. the pacakge length is almost handres to thoudants byte.

plz give me some suggest

**Comment by menghanl** [comment]
It definitely doesn't sound right that smaller messages result in more bytes. But it's not clear how many messages you are sending?
Not sure why you saw big TCP packages, but notice that a TCP package may have more than one message. They are not 1-1 mapping.

> When the msg is less ,the more times of send called ,the bandwidth is more larger
Time spent in send doesn't mean much. Roundtrip time would make more sense.
I not sure what you mean by bandwidth is larger in this case.

If you want to know more about gRPC performance (latency and bandwidth), take a look at our benchmark: https://github.com/grpc/grpc-go/blob/master/benchmark
(to run them, use [this](https://github.com/grpc/grpc-go/blob/master/benchmark/benchmain/main.go))

**Comment by bugaolengdeyuxiaoer** [comment]
@menghanl firstly thank for you reply.
I didn`t describe my question clearly.
I `m doing bandwidth limit . When the bandwidth is set ,data will take permits from the ratelimiter.That rate could be one byte to one permit.So small msg will send more frequency than larger ones ,and that will cause the IP 、tcp、http2 headers send more frequency. And this is the reason why small msg will cause larger bandwidth .
Anyway thank u.
